{
  "$schema": "https://json-schema.org/draft/2020-12/schema",
  "$id": "https://github.com/clickbytes/golingua/schemas/semantic/context.schema.json",
  "title": "GoLingua request-local reference and condition context",
  "description": "Explicit, request-local referents, mention links, inert evidence, and semantic conditions. This document is not a persistent memory or fact store.",
  "$comment": "Runtime enforces a 1048576-byte JSON limit, nesting at most 256, IDs at most 256 UTF-8 bytes, 512 referents, 512 mentions, 1024 evidence rows, 128 conditions, 4096 aggregate condition-expression nodes, and 262144 checker work units. Nominal referent sorts must exist in the actual checked declaration document. temporal_frame and reference_time_id are Event-only; multiplicity is Entity/Nominal-only; a reference_time_id must name an Interval in the same available reference context. Empty Go values are omitted and never inferred. SourceRef.Validate enforces exactly one usable path or URI. Evidence provenance integrity does not prove world truth. Resolution status is derived only from explicit evidence rows.",
  "type": "object",
  "additionalProperties": false,
  "required": ["schema_version", "id", "referents", "mentions", "resolution_evidence", "conditions"],
  "properties": {
    "schema_version": {"const": 1},
    "id": {"$ref": "#/\u0024defs/id"},
    "referents": {"type": "array", "maxItems": 512, "items": {"$ref": "#/\u0024defs/referent"}},
    "speaker_referent_id": {"$ref": "#/\u0024defs/id", "$comment": "Optional request-local anchor; it does not identify a person outside this context."},
    "addressee_referent_id": {"$ref": "#/\u0024defs/id", "$comment": "Optional request-local anchor; it does not identify a person outside this context."},
    "mentions": {"type": "array", "maxItems": 512, "items": {"$ref": "#/\u0024defs/mention"}},
    "resolution_evidence": {"type": "array", "maxItems": 1024, "items": {"$ref": "#/\u0024defs/evidence"}},
    "conditions": {"type": "array", "maxItems": 128, "items": {"$ref": "#/\u0024defs/condition"}}
  },
  "$defs": {
    "id": {"type": "string", "minLength": 1, "maxLength": 256, "$comment": "Runtime bound is UTF-8 bytes."},
    "data_type": {
      "oneOf": [
        {"type": "object", "additionalProperties": false, "required": ["kind"], "properties": {"kind": {"const": "Entity"}}},
        {"type": "object", "additionalProperties": false, "required": ["kind"], "properties": {"kind": {"const": "Event"}}},
        {"type": "object", "additionalProperties": false, "required": ["kind"], "properties": {"kind": {"const": "Interval"}}},
        {"type": "object", "additionalProperties": false, "required": ["kind", "sort_id"], "properties": {"kind": {"const": "Nominal"}, "sort_id": {"$ref": "expression.schema.json#/\u0024defs/id"}}, "$comment": "The nominal sort must be declared in the actual checked document."}
      ]
    },
    "referent": {
      "type": "object",
      "additionalProperties": false,
      "required": ["id", "type"],
      "properties": {
        "id": {"$ref": "#/\u0024defs/id"},
        "type": {"$ref": "#/\u0024defs/data_type"},
        "concept_id": {"type": "string", "minLength": 1, "maxLength": 256, "$comment": "Optional classification metadata only; equal concept IDs never merge referents."},
        "temporal_frame": {"enum": ["past", "present"]},
        "reference_time_id": {"$ref": "#/$defs/id"},
        "multiplicity": {"enum": ["one", "many"]}
      }
    },
    "mention": {
      "type": "object",
      "additionalProperties": false,
      "required": ["id"],
      "properties": {
        "id": {"$ref": "#/\u0024defs/id"},
        "context_id": {"$ref": "#/\u0024defs/id"},
        "referent_id": {"$ref": "#/\u0024defs/id", "$comment": "A target claim requires corroborating resolution_evidence."}
      }
    },
    "source_ref": {"$ref": "package.schema.json#/\u0024defs/source_ref"},
    "evidence": {
      "type": "object",
      "additionalProperties": false,
      "required": ["id", "mention_id", "referent_id", "source"],
      "properties": {
        "id": {"$ref": "#/\u0024defs/id"},
        "mention_id": {"$ref": "#/\u0024defs/id"},
        "referent_id": {"$ref": "#/\u0024defs/id"},
        "source": {"$ref": "#/\u0024defs/source_ref", "$comment": "Attribution integrity only, not a truth certificate."}
      }
    },
    "condition": {
      "type": "object",
      "additionalProperties": false,
      "required": ["id", "kind", "code", "target_referent_ids"],
      "properties": {
        "id": {"$ref": "#/\u0024defs/id"},
        "kind": {"enum": ["assumption", "presupposition", "loss"]},
        "code": {"$ref": "#/\u0024defs/id", "$comment": "Opaque label; it is not interpreted as a predicate or rule."},
        "target_referent_ids": {"type": "array", "maxItems": 512, "uniqueItems": true, "items": {"$ref": "#/\u0024defs/id"}},
        "expression": {"$ref": "expression.schema.json#/\u0024defs/term", "$comment": "If present, runtime checks this expression has type Prop. It is not evaluated."},
        "detail": {"type": "string", "maxLength": 1024, "$comment": "Human-readable detail only; runtime bound is UTF-8 bytes."}
      }
    }
  }
}
