{
  "schema_version": 1,
  "id": "ctx-reference",
  "referents": [
    {
      "id": "A",
      "type": {
        "kind": "Entity"
      },
      "concept_id": "concept:category.k"
    },
    {
      "id": "B",
      "type": {
        "kind": "Entity"
      },
      "concept_id": "concept:category.k"
    }
  ],
  "speaker_referent_id": "A",
  "addressee_referent_id": "B",
  "mentions": [
    {
      "id": "m1",
      "context_id": "ctx-reference",
      "referent_id": "A"
    },
    {
      "id": "m2",
      "referent_id": "A"
    }
  ],
  "resolution_evidence": [],
  "conditions": [
    {
      "id": "assumption1",
      "kind": "assumption",
      "code": "existence_not_verified",
      "target_referent_ids": [
        "A"
      ],
      "expression": {
        "kind": "Exists",
        "id": "z",
        "type": {
          "kind": "Entity"
        },
        "body": {
          "kind": "Atom",
          "symbol": "p",
          "args": [
            {
              "role": "v",
              "value": {
                "kind": "Var",
                "id": "z"
              }
            }
          ]
        }
      }
    },
    {
      "id": "presupposition1",
      "kind": "presupposition",
      "code": "uniqueness_not_verified",
      "target_referent_ids": [
        "A"
      ],
      "expression": {
        "kind": "Quantifier",
        "quantifier": "exactly",
        "count": 1,
        "id": "A",
        "type": {
          "kind": "Entity"
        },
        "body": {
          "kind": "Atom",
          "symbol": "p",
          "args": [
            {
              "role": "v",
              "value": {
                "kind": "Var",
                "id": "A"
              }
            }
          ]
        }
      }
    },
    {
      "id": "loss1",
      "kind": "loss",
      "code": "deixis_proximity_unresolved",
      "target_referent_ids": [
        "A"
      ],
      "detail": "No proximity value is supplied."
    }
  ]
}
